{
  "$schema": "https://json-schema.org/draft/2020-12/schema",
  "$id": "https://40kdc.dev/schemas/core/leader-attachment.schema.json",
  "title": "Leader Attachment",
  "description": "Defines which character units can attach to which bodyguard units.",
  "type": "object",
  "properties": {
    "leader_id": { "$ref": "../defs/common.schema.json#/$defs/entity-id" },
    "eligible_bodyguard_ids": {
      "type": "array",
      "items": { "$ref": "../defs/common.schema.json#/$defs/entity-id" },
      "minItems": 1
    },
    "max_leaders_per_unit": { "type": "integer", "minimum": 1, "default": 1 },
    "game_version": { "$ref": "../defs/game-version-ref.schema.json" }
  },
  "required": ["leader_id", "eligible_bodyguard_ids", "game_version"],
  "additionalProperties": false
}
