[
  {
    "leader_id": "canoness-with-jump-pack",
    "eligible_bodyguard_ids": [
      "seraphim-squad",
      "zephyrim-squad"
    ],
    "max_leaders_per_unit": 1,
    "game_version": {
      "edition": "10th",
      "dataslate": "2025-q3"
    }
  },
  {
    "leader_id": "palatine",
    "eligible_bodyguard_ids": [
      "battle-sisters-squad",
      "celestian-sacresants",
      "dominion-squad",
      "retributor-squad",
      "sisters-novitiate-squad"
    ],
    "max_leaders_per_unit": 1,
    "game_version": {
      "edition": "10th",
      "dataslate": "2025-q3"
    }
  },
  {
    "leader_id": "imagifier",
    "eligible_bodyguard_ids": [
      "battle-sisters-squad",
      "celestian-sacresants",
      "dominion-squad",
      "retributor-squad"
    ],
    "max_leaders_per_unit": 1,
    "game_version": {
      "edition": "10th",
      "dataslate": "2025-q3"
    }
  },
  {
    "leader_id": "triumph-of-saint-katherine",
    "eligible_bodyguard_ids": [
      "battle-sisters-squad"
    ],
    "max_leaders_per_unit": 1,
    "game_version": {
      "edition": "10th",
      "dataslate": "2025-q3"
    }
  },
  {
    "leader_id": "dialogus",
    "eligible_bodyguard_ids": [
      "battle-sisters-squad",
      "celestian-sacresants",
      "dominion-squad",
      "retributor-squad",
      "sisters-novitiate-squad"
    ],
    "max_leaders_per_unit": 1,
    "game_version": {
      "edition": "10th",
      "dataslate": "2025-q3"
    }
  },
  {
    "leader_id": "dogmata",
    "eligible_bodyguard_ids": [
      "battle-sisters-squad",
      "celestian-sacresants",
      "dominion-squad",
      "retributor-squad"
    ],
    "max_leaders_per_unit": 1,
    "game_version": {
      "edition": "10th",
      "dataslate": "2025-q3"
    }
  },
  {
    "leader_id": "hospitaller",
    "eligible_bodyguard_ids": [
      "battle-sisters-squad",
      "celestian-sacresants",
      "dominion-squad",
      "retributor-squad",
      "sisters-novitiate-squad"
    ],
    "max_leaders_per_unit": 1,
    "game_version": {
      "edition": "10th",
      "dataslate": "2025-q3"
    }
  },
  {
    "leader_id": "morvenn-vahl",
    "eligible_bodyguard_ids": [
      "paragon-warsuits"
    ],
    "max_leaders_per_unit": 1,
    "game_version": {
      "edition": "10th",
      "dataslate": "2025-q3"
    }
  },
  {
    "leader_id": "junith-eruita",
    "eligible_bodyguard_ids": [
      "battle-sisters-squad",
      "celestian-sacresants",
      "dominion-squad",
      "retributor-squad",
      "sisters-novitiate-squad"
    ],
    "max_leaders_per_unit": 1,
    "game_version": {
      "edition": "10th",
      "dataslate": "2025-q3"
    }
  },
  {
    "leader_id": "ministorum-priest",
    "eligible_bodyguard_ids": [
      "arco-flagellants",
      "battle-sisters-squad",
      "dominion-squad",
      "sisters-novitiate-squad"
    ],
    "max_leaders_per_unit": 1,
    "game_version": {
      "edition": "10th",
      "dataslate": "2025-q3"
    }
  },
  {
    "leader_id": "saint-celestine",
    "eligible_bodyguard_ids": [
      "seraphim-squad",
      "zephyrim-squad"
    ],
    "max_leaders_per_unit": 1,
    "game_version": {
      "edition": "10th",
      "dataslate": "2025-q3"
    }
  },
  {
    "leader_id": "canoness",
    "eligible_bodyguard_ids": [
      "battle-sisters-squad",
      "celestian-sacresants",
      "dominion-squad",
      "retributor-squad"
    ],
    "max_leaders_per_unit": 1,
    "game_version": {
      "edition": "10th",
      "dataslate": "2025-q3"
    }
  },
  {
    "leader_id": "aestred-thurga-and-agathae-dolan",
    "eligible_bodyguard_ids": [
      "battle-sisters-squad",
      "celestian-sacresants",
      "dominion-squad",
      "retributor-squad",
      "sisters-novitiate-squad"
    ],
    "max_leaders_per_unit": 1,
    "game_version": {
      "edition": "10th",
      "dataslate": "2025-q3"
    }
  }
]
