[
  {
    "leader_id": "clamavus",
    "eligible_bodyguard_ids": [
      "hybrid-metamorphs",
      "neophyte-hybrids"
    ],
    "max_leaders_per_unit": 1,
    "game_version": {
      "edition": "10th",
      "dataslate": "2025-q3"
    }
  },
  {
    "leader_id": "patriarch",
    "eligible_bodyguard_ids": [
      "purestrain-genestealers"
    ],
    "max_leaders_per_unit": 1,
    "game_version": {
      "edition": "10th",
      "dataslate": "2025-q3"
    }
  },
  {
    "leader_id": "biophagus",
    "eligible_bodyguard_ids": [
      "aberrants",
      "hybrid-metamorphs",
      "neophyte-hybrids"
    ],
    "max_leaders_per_unit": 1,
    "game_version": {
      "edition": "10th",
      "dataslate": "2025-q3"
    }
  },
  {
    "leader_id": "acolyte-iconward",
    "eligible_bodyguard_ids": [
      "hybrid-metamorphs",
      "neophyte-hybrids"
    ],
    "max_leaders_per_unit": 1,
    "game_version": {
      "edition": "10th",
      "dataslate": "2025-q3"
    }
  },
  {
    "leader_id": "primus",
    "eligible_bodyguard_ids": [
      "hybrid-metamorphs",
      "neophyte-hybrids"
    ],
    "max_leaders_per_unit": 1,
    "game_version": {
      "edition": "10th",
      "dataslate": "2025-q3"
    }
  },
  {
    "leader_id": "abominant",
    "eligible_bodyguard_ids": [
      "aberrants"
    ],
    "max_leaders_per_unit": 1,
    "game_version": {
      "edition": "10th",
      "dataslate": "2025-q3"
    }
  },
  {
    "leader_id": "nexos",
    "eligible_bodyguard_ids": [
      "hybrid-metamorphs",
      "neophyte-hybrids"
    ],
    "max_leaders_per_unit": 1,
    "game_version": {
      "edition": "10th",
      "dataslate": "2025-q3"
    }
  },
  {
    "leader_id": "jackal-alphus",
    "eligible_bodyguard_ids": [
      "atalan-jackals"
    ],
    "max_leaders_per_unit": 1,
    "game_version": {
      "edition": "10th",
      "dataslate": "2025-q3"
    }
  },
  {
    "leader_id": "locus",
    "eligible_bodyguard_ids": [
      "hybrid-metamorphs",
      "neophyte-hybrids"
    ],
    "max_leaders_per_unit": 1,
    "game_version": {
      "edition": "10th",
      "dataslate": "2025-q3"
    }
  },
  {
    "leader_id": "benefictus",
    "eligible_bodyguard_ids": [
      "hybrid-metamorphs",
      "neophyte-hybrids"
    ],
    "max_leaders_per_unit": 1,
    "game_version": {
      "edition": "10th",
      "dataslate": "2025-q3"
    }
  },
  {
    "leader_id": "magus",
    "eligible_bodyguard_ids": [
      "hybrid-metamorphs",
      "neophyte-hybrids"
    ],
    "max_leaders_per_unit": 1,
    "game_version": {
      "edition": "10th",
      "dataslate": "2025-q3"
    }
  }
]
