[
  {
    "leader_id": "sorcerer-in-terminator-armour",
    "eligible_bodyguard_ids": [
      "chaos-terminator-squad"
    ],
    "max_leaders_per_unit": 1,
    "game_version": {
      "edition": "10th",
      "dataslate": "2025-q3"
    }
  },
  {
    "leader_id": "sorcerer",
    "eligible_bodyguard_ids": [
      "chosen",
      "legionaries"
    ],
    "max_leaders_per_unit": 1,
    "game_version": {
      "edition": "10th",
      "dataslate": "2025-q3"
    }
  },
  {
    "leader_id": "dark-commune",
    "eligible_bodyguard_ids": [
      "accursed-cultists",
      "cultist-mob"
    ],
    "max_leaders_per_unit": 1,
    "game_version": {
      "edition": "10th",
      "dataslate": "2025-q3"
    }
  },
  {
    "leader_id": "master-of-possession",
    "eligible_bodyguard_ids": [
      "chosen",
      "legionaries",
      "possessed"
    ],
    "max_leaders_per_unit": 1,
    "game_version": {
      "edition": "10th",
      "dataslate": "2025-q3"
    }
  },
  {
    "leader_id": "cultist-firebrand",
    "eligible_bodyguard_ids": [
      "accursed-cultists",
      "cultist-mob"
    ],
    "max_leaders_per_unit": 1,
    "game_version": {
      "edition": "10th",
      "dataslate": "2025-q3"
    }
  },
  {
    "leader_id": "traitor-enforcer",
    "eligible_bodyguard_ids": [
      "traitor-guardsmen-squad"
    ],
    "max_leaders_per_unit": 1,
    "game_version": {
      "edition": "10th",
      "dataslate": "2025-q3"
    }
  },
  {
    "leader_id": "dark-apostle",
    "eligible_bodyguard_ids": [
      "accursed-cultists",
      "chosen",
      "cultist-mob",
      "legionaries"
    ],
    "max_leaders_per_unit": 1,
    "game_version": {
      "edition": "10th",
      "dataslate": "2025-q3"
    }
  },
  {
    "leader_id": "warpsmith",
    "eligible_bodyguard_ids": [
      "chosen",
      "havocs",
      "legionaries"
    ],
    "max_leaders_per_unit": 1,
    "game_version": {
      "edition": "10th",
      "dataslate": "2025-q3"
    }
  },
  {
    "leader_id": "chaos-lord-in-terminator-armour",
    "eligible_bodyguard_ids": [
      "chaos-terminator-squad"
    ],
    "max_leaders_per_unit": 1,
    "game_version": {
      "edition": "10th",
      "dataslate": "2025-q3"
    }
  },
  {
    "leader_id": "master-of-executions",
    "eligible_bodyguard_ids": [
      "chosen",
      "legionaries"
    ],
    "max_leaders_per_unit": 1,
    "game_version": {
      "edition": "10th",
      "dataslate": "2025-q3"
    }
  },
  {
    "leader_id": "chaos-lord-with-jump-pack",
    "eligible_bodyguard_ids": [
      "raptors"
    ],
    "max_leaders_per_unit": 1,
    "game_version": {
      "edition": "10th",
      "dataslate": "2025-q3"
    }
  },
  {
    "leader_id": "chaos-lord",
    "eligible_bodyguard_ids": [
      "chosen",
      "legionaries"
    ],
    "max_leaders_per_unit": 1,
    "game_version": {
      "edition": "10th",
      "dataslate": "2025-q3"
    }
  },
  {
    "leader_id": "red-corsairs-reave-captain",
    "eligible_bodyguard_ids": [
      "chosen",
      "legionaries",
      "red-corsairs-raiders"
    ],
    "max_leaders_per_unit": 1,
    "game_version": {
      "edition": "10th",
      "dataslate": "2025-q3"
    }
  },
  {
    "leader_id": "huron-blackheart",
    "eligible_bodyguard_ids": [
      "chaos-terminator-squad",
      "chosen",
      "legionaries",
      "masters-of-the-maelstrom",
      "red-corsairs-raiders"
    ],
    "max_leaders_per_unit": 1,
    "game_version": {
      "edition": "10th",
      "dataslate": "2025-q3"
    }
  },
  {
    "leader_id": "haarken-worldclaimer",
    "eligible_bodyguard_ids": [
      "raptors"
    ],
    "max_leaders_per_unit": 1,
    "game_version": {
      "edition": "10th",
      "dataslate": "2025-q3"
    }
  },
  {
    "leader_id": "abaddon-the-despoiler",
    "eligible_bodyguard_ids": [
      "chaos-terminator-squad",
      "chosen"
    ],
    "max_leaders_per_unit": 1,
    "game_version": {
      "edition": "10th",
      "dataslate": "2025-q3"
    }
  },
  {
    "leader_id": "fabius-bile",
    "eligible_bodyguard_ids": [
      "accursed-cultists",
      "chosen",
      "cultist-mob",
      "legionaries"
    ],
    "max_leaders_per_unit": 1,
    "game_version": {
      "edition": "10th",
      "dataslate": "2025-q3"
    }
  },
  {
    "leader_id": "rogue-psyker",
    "eligible_bodyguard_ids": [
      "accursed-cultists",
      "cultist-mob",
      "negavolt-cultists"
    ],
    "max_leaders_per_unit": 1,
    "game_version": {
      "edition": "10th",
      "dataslate": "2025-q3"
    }
  },
  {
    "leader_id": "sorcerer-on-bike",
    "eligible_bodyguard_ids": [
      "chaos-bikers"
    ],
    "max_leaders_per_unit": 1,
    "game_version": {
      "edition": "10th",
      "dataslate": "2025-q3"
    }
  },
  {
    "leader_id": "sorcerer-on-disc-of-tzeentch",
    "eligible_bodyguard_ids": [
      "chosen",
      "legionaries"
    ],
    "max_leaders_per_unit": 1,
    "game_version": {
      "edition": "10th",
      "dataslate": "2025-q3"
    }
  },
  {
    "leader_id": "sorcerer-on-palanquin-of-nurgle",
    "eligible_bodyguard_ids": [
      "chosen",
      "legionaries"
    ],
    "max_leaders_per_unit": 1,
    "game_version": {
      "edition": "10th",
      "dataslate": "2025-q3"
    }
  },
  {
    "leader_id": "sorcerer-on-steed-of-slaanesh",
    "eligible_bodyguard_ids": [
      "chaos-bikers"
    ],
    "max_leaders_per_unit": 1,
    "game_version": {
      "edition": "10th",
      "dataslate": "2025-q3"
    }
  },
  {
    "leader_id": "chaos-lord-on-palanquin-of-nurgle",
    "eligible_bodyguard_ids": [
      "chosen",
      "legionaries"
    ],
    "max_leaders_per_unit": 1,
    "game_version": {
      "edition": "10th",
      "dataslate": "2025-q3"
    }
  },
  {
    "leader_id": "chaos-lord-on-steed-of-slaanesh",
    "eligible_bodyguard_ids": [
      "chaos-bikers"
    ],
    "max_leaders_per_unit": 1,
    "game_version": {
      "edition": "10th",
      "dataslate": "2025-q3"
    }
  },
  {
    "leader_id": "chaos-lord-on-juggernaut",
    "eligible_bodyguard_ids": [
      "chaos-bikers"
    ],
    "max_leaders_per_unit": 1,
    "game_version": {
      "edition": "10th",
      "dataslate": "2025-q3"
    }
  },
  {
    "leader_id": "chaos-lord-on-disc-of-tzeentch",
    "eligible_bodyguard_ids": [
      "chosen",
      "legionaries"
    ],
    "max_leaders_per_unit": 1,
    "game_version": {
      "edition": "10th",
      "dataslate": "2025-q3"
    }
  },
  {
    "leader_id": "chaos-lord-on-bike",
    "eligible_bodyguard_ids": [
      "chaos-bikers"
    ],
    "max_leaders_per_unit": 1,
    "game_version": {
      "edition": "10th",
      "dataslate": "2025-q3"
    }
  },
  {
    "leader_id": "renegade-enforcer",
    "eligible_bodyguard_ids": [
      "renegade-heavy-weapons-squad",
      "traitor-guardsmen-squad"
    ],
    "max_leaders_per_unit": 1,
    "game_version": {
      "edition": "10th",
      "dataslate": "2025-q3"
    }
  }
]
