[
  {
    "leader_id": "cybernetica-datasmith",
    "eligible_bodyguard_ids": [
      "kastelan-robots"
    ],
    "max_leaders_per_unit": 1,
    "game_version": {
      "edition": "10th",
      "dataslate": "2025-q3"
    }
  },
  {
    "leader_id": "tech-priest-manipulus",
    "eligible_bodyguard_ids": [
      "corpuscarii-electro-priests",
      "fulgurite-electro-priests",
      "kataphron-breachers",
      "kataphron-destroyers",
      "skitarii-rangers",
      "skitarii-vanguard"
    ],
    "max_leaders_per_unit": 1,
    "game_version": {
      "edition": "10th",
      "dataslate": "2025-q3"
    }
  },
  {
    "leader_id": "tech-priest-dominus",
    "eligible_bodyguard_ids": [
      "corpuscarii-electro-priests",
      "fulgurite-electro-priests",
      "kataphron-breachers",
      "kataphron-destroyers",
      "skitarii-rangers",
      "skitarii-vanguard"
    ],
    "max_leaders_per_unit": 1,
    "game_version": {
      "edition": "10th",
      "dataslate": "2025-q3"
    }
  },
  {
    "leader_id": "technoarcheologist",
    "eligible_bodyguard_ids": [
      "corpuscarii-electro-priests",
      "fulgurite-electro-priests",
      "kataphron-breachers",
      "kataphron-destroyers",
      "skitarii-rangers",
      "skitarii-vanguard"
    ],
    "max_leaders_per_unit": 1,
    "game_version": {
      "edition": "10th",
      "dataslate": "2025-q3"
    }
  },
  {
    "leader_id": "tech-priest-enginseer",
    "eligible_bodyguard_ids": [
      "corpuscarii-electro-priests",
      "fulgurite-electro-priests",
      "kataphron-breachers",
      "kataphron-destroyers",
      "skitarii-rangers",
      "skitarii-vanguard"
    ],
    "max_leaders_per_unit": 1,
    "game_version": {
      "edition": "10th",
      "dataslate": "2025-q3"
    }
  },
  {
    "leader_id": "skitarii-marshal",
    "eligible_bodyguard_ids": [
      "skitarii-rangers",
      "skitarii-vanguard"
    ],
    "max_leaders_per_unit": 1,
    "game_version": {
      "edition": "10th",
      "dataslate": "2025-q3"
    }
  }
]
