[
  {
    "leader_id": "blade-champion",
    "eligible_bodyguard_ids": [
      "custodian-guard",
      "custodian-wardens"
    ],
    "max_leaders_per_unit": 1,
    "game_version": {
      "edition": "10th",
      "dataslate": "2025-q3"
    }
  },
  {
    "leader_id": "shield-captain-on-dawneagle-jetbike",
    "eligible_bodyguard_ids": [
      "vertus-praetors"
    ],
    "max_leaders_per_unit": 1,
    "game_version": {
      "edition": "10th",
      "dataslate": "2025-q3"
    }
  },
  {
    "leader_id": "knight-centura",
    "eligible_bodyguard_ids": [
      "prosecutors",
      "vigilators",
      "witchseekers"
    ],
    "max_leaders_per_unit": 1,
    "game_version": {
      "edition": "10th",
      "dataslate": "2025-q3"
    }
  },
  {
    "leader_id": "aleya",
    "eligible_bodyguard_ids": [
      "prosecutors",
      "vigilators",
      "witchseekers"
    ],
    "max_leaders_per_unit": 1,
    "game_version": {
      "edition": "10th",
      "dataslate": "2025-q3"
    }
  },
  {
    "leader_id": "valerian",
    "eligible_bodyguard_ids": [
      "custodian-guard",
      "custodian-wardens"
    ],
    "max_leaders_per_unit": 1,
    "game_version": {
      "edition": "10th",
      "dataslate": "2025-q3"
    }
  },
  {
    "leader_id": "shield-captain-in-allarus-terminator-armour",
    "eligible_bodyguard_ids": [
      "allarus-custodians"
    ],
    "max_leaders_per_unit": 1,
    "game_version": {
      "edition": "10th",
      "dataslate": "2025-q3"
    }
  },
  {
    "leader_id": "shield-captain",
    "eligible_bodyguard_ids": [
      "custodian-guard",
      "custodian-wardens"
    ],
    "max_leaders_per_unit": 1,
    "game_version": {
      "edition": "10th",
      "dataslate": "2025-q3"
    }
  },
  {
    "leader_id": "trajann-valoris",
    "eligible_bodyguard_ids": [
      "custodian-guard",
      "custodian-wardens"
    ],
    "max_leaders_per_unit": 1,
    "game_version": {
      "edition": "10th",
      "dataslate": "2025-q3"
    }
  }
]
