[
  {
    "leader_id": "succubus",
    "eligible_bodyguard_ids": [
      "wyches"
    ],
    "max_leaders_per_unit": 1,
    "game_version": {
      "edition": "10th",
      "dataslate": "2025-q3"
    }
  },
  {
    "leader_id": "lelith-hesperax",
    "eligible_bodyguard_ids": [
      "wyches"
    ],
    "max_leaders_per_unit": 1,
    "game_version": {
      "edition": "10th",
      "dataslate": "2025-q3"
    }
  },
  {
    "leader_id": "haemonculus",
    "eligible_bodyguard_ids": [
      "wracks"
    ],
    "max_leaders_per_unit": 1,
    "game_version": {
      "edition": "10th",
      "dataslate": "2025-q3"
    }
  },
  {
    "leader_id": "archon",
    "eligible_bodyguard_ids": [
      "hand-of-the-archon",
      "incubi",
      "kabalite-warriors"
    ],
    "max_leaders_per_unit": 1,
    "game_version": {
      "edition": "10th",
      "dataslate": "2025-q3"
    }
  },
  {
    "leader_id": "lady-malys",
    "eligible_bodyguard_ids": [
      "hand-of-the-archon",
      "incubi",
      "kabalite-warriors"
    ],
    "max_leaders_per_unit": 1,
    "game_version": {
      "edition": "10th",
      "dataslate": "2025-q3"
    }
  },
  {
    "leader_id": "drazhar",
    "eligible_bodyguard_ids": [
      "incubi"
    ],
    "max_leaders_per_unit": 1,
    "game_version": {
      "edition": "10th",
      "dataslate": "2025-q3"
    }
  }
]
