[
  {
    "leader_id": "bloodmaster",
    "eligible_bodyguard_ids": [
      "bloodletters"
    ],
    "max_leaders_per_unit": 1,
    "game_version": {
      "edition": "10th",
      "dataslate": "2025-q3"
    }
  },
  {
    "leader_id": "tranceweaver",
    "eligible_bodyguard_ids": [
      "daemonettes"
    ],
    "max_leaders_per_unit": 1,
    "game_version": {
      "edition": "10th",
      "dataslate": "2025-q3"
    }
  },
  {
    "leader_id": "infernal-enrapturess",
    "eligible_bodyguard_ids": [
      "daemonettes"
    ],
    "max_leaders_per_unit": 1,
    "game_version": {
      "edition": "10th",
      "dataslate": "2025-q3"
    }
  },
  {
    "leader_id": "syllesske",
    "eligible_bodyguard_ids": [
      "daemonettes"
    ],
    "max_leaders_per_unit": 1,
    "game_version": {
      "edition": "10th",
      "dataslate": "2025-q3"
    }
  },
  {
    "leader_id": "changecaster",
    "eligible_bodyguard_ids": [
      "blue-horrors",
      "pink-horrors"
    ],
    "max_leaders_per_unit": 1,
    "game_version": {
      "edition": "10th",
      "dataslate": "2025-q3"
    }
  },
  {
    "leader_id": "horticulous-slimux",
    "eligible_bodyguard_ids": [
      "beasts-of-nurgle"
    ],
    "max_leaders_per_unit": 1,
    "game_version": {
      "edition": "10th",
      "dataslate": "2025-q3"
    }
  },
  {
    "leader_id": "contorted-epitome",
    "eligible_bodyguard_ids": [
      "daemonettes"
    ],
    "max_leaders_per_unit": 1,
    "game_version": {
      "edition": "10th",
      "dataslate": "2025-q3"
    }
  },
  {
    "leader_id": "poxbringer",
    "eligible_bodyguard_ids": [
      "plaguebearers"
    ],
    "max_leaders_per_unit": 1,
    "game_version": {
      "edition": "10th",
      "dataslate": "2025-q3"
    }
  },
  {
    "leader_id": "fateskimmer",
    "eligible_bodyguard_ids": [
      "screamers"
    ],
    "max_leaders_per_unit": 1,
    "game_version": {
      "edition": "10th",
      "dataslate": "2025-q3"
    }
  },
  {
    "leader_id": "exalted-flamer",
    "eligible_bodyguard_ids": [
      "flamers"
    ],
    "max_leaders_per_unit": 1,
    "game_version": {
      "edition": "10th",
      "dataslate": "2025-q3"
    }
  },
  {
    "leader_id": "skullmaster",
    "eligible_bodyguard_ids": [
      "bloodcrushers"
    ],
    "max_leaders_per_unit": 1,
    "game_version": {
      "edition": "10th",
      "dataslate": "2025-q3"
    }
  },
  {
    "leader_id": "epidemius",
    "eligible_bodyguard_ids": [
      "plaguebearers"
    ],
    "max_leaders_per_unit": 1,
    "game_version": {
      "edition": "10th",
      "dataslate": "2025-q3"
    }
  },
  {
    "leader_id": "karanak",
    "eligible_bodyguard_ids": [
      "flesh-hounds"
    ],
    "max_leaders_per_unit": 1,
    "game_version": {
      "edition": "10th",
      "dataslate": "2025-q3"
    }
  },
  {
    "leader_id": "spoilpox-scrivener",
    "eligible_bodyguard_ids": [
      "plaguebearers"
    ],
    "max_leaders_per_unit": 1,
    "game_version": {
      "edition": "10th",
      "dataslate": "2025-q3"
    }
  },
  {
    "leader_id": "tormentbringer",
    "eligible_bodyguard_ids": [
      "hellflayers"
    ],
    "max_leaders_per_unit": 1,
    "game_version": {
      "edition": "10th",
      "dataslate": "2025-q3"
    }
  },
  {
    "leader_id": "skulltaker",
    "eligible_bodyguard_ids": [
      "bloodletters"
    ],
    "max_leaders_per_unit": 1,
    "game_version": {
      "edition": "10th",
      "dataslate": "2025-q3"
    }
  },
  {
    "leader_id": "sloppity-bilepiper",
    "eligible_bodyguard_ids": [
      "plaguebearers"
    ],
    "max_leaders_per_unit": 1,
    "game_version": {
      "edition": "10th",
      "dataslate": "2025-q3"
    }
  },
  {
    "leader_id": "fluxmaster",
    "eligible_bodyguard_ids": [
      "blue-horrors",
      "pink-horrors"
    ],
    "max_leaders_per_unit": 1,
    "game_version": {
      "edition": "10th",
      "dataslate": "2025-q3"
    }
  },
  {
    "leader_id": "herald-of-slaanesh-on-steed-of-slaanesh",
    "eligible_bodyguard_ids": [
      "seekers"
    ],
    "max_leaders_per_unit": 1,
    "game_version": {
      "edition": "10th",
      "dataslate": "2025-q3"
    }
  }
]
